[
  {
    "customer_number": "jujMirwARQ",
    "account_sid": "KdZUhgJSci",
    "source_system": "ybkUNeTnum",
    "source_system_det": "ZOPBLoQNjd",
    "css_des_customer_status": "DaJJMvHpMg",
    "birthdate": "VvMrdEJGqO",
    "salutation": "VQgGfbayAm",
    "firstname": "ESVUCkuZJf",
    "lastname": "pKQrdMcwwR",
    "country": "rYrxASQCzt",
    "postal_code": "iDdqdbmAjW",
    "city": "dFhUUiKWSn",
    "street": "kluErXhSpQ",
    "add_des_house_number": "QDsqJHpFTq"
  },
  {
    "customer_number": "fwbTNxdPEx",
    "account_sid": "RhhRVapotm",
    "source_system": "CVEKIyCHBn",
    "source_system_det": "RioQfZAtFz",
    "css_des_customer_status": "trUiCoCQlw",
    "birthdate": "NBSDypvZQS",
    "salutation": "EmssNWwuzf",
    "firstname": "uqsLuqRuDH",
    "lastname": "NBKafefrJJ",
    "country": "olEZiVihzt",
    "postal_code": "RzQNocHNUU",
    "city": "JgnAtCPdwO",
    "street": "uyPNbtZSXe",
    "add_des_house_number": "QytuLoTiVr"
  },
  {
    "customer_number": "STGfSjTepp",
    "account_sid": "VVAqOBdfcx",
    "source_system": "iAGzekujEh",
    "source_system_det": "kvwNLTdgOP",
    "css_des_customer_status": "gHPCKDnBje",
    "birthdate": "BVdwjZyuRr",
    "salutation": "MFvIcEUBzk",
    "firstname": "hAeZarNwLw",
    "lastname": "IHRpQHqaGv",
    "country": "TAmStMefZa",
    "postal_code": "YOubsTjCXD",
    "city": "IhkYmRevGt",
    "street": "gdnnqvcQLQ",
    "add_des_house_number": "fhBiHgqeWL"
  },
  {
    "customer_number": "UtgxFFKeoR",
    "account_sid": "aqcJwsMKOn",
    "source_system": "HGmlyCrchW",
    "source_system_det": "EUWjDeXNuj",
    "css_des_customer_status": "aLTSLGqonL",
    "birthdate": "XHgXuvXNNX",
    "salutation": "lFsZNoDnuj",
    "firstname": "EWUHIGQzMu",
    "lastname": "MAIQoRcbuB",
    "country": "ZsBtvsWsnx",
    "postal_code": "pLHempRlpp",
    "city": "NnScpqXubG",
    "street": "kECEpZyuRu",
    "add_des_house_number": "WUpPsOPcwD"
  },
  {
    "customer_number": "kCodYXBwaU",
    "account_sid": "LHknrRvjUH",
    "source_system": "xaheJkhQOv",
    "source_system_det": "pNVLvGWzYx",
    "css_des_customer_status": "cgbtyLVWak",
    "birthdate": "FaNGPpQyIk",
    "salutation": "UplbGkhHCF",
    "firstname": "bjCovypGTq",
    "lastname": "bDDBBBAbMy",
    "country": "ZLUnwvttJi",
    "postal_code": "spMqwUttac",
    "city": "pJcyUSKWsm",
    "street": "umvpctbrOj",
    "add_des_house_number": "UFCavvZqWl"
  }
]